{
  "$schema": "https://json-schema.org/draft/2020-12/schema",
  "type": "object",
  "properties": {
    "$schema": {
      "description": "Path to the JSON Schema, for editor autocompletion.",
      "type": "string"
    },
    "name": {
      "type": "string",
      "minLength": 1,
      "maxLength": 64,
      "description": "Display name of the site. The file name must be the slug of this name."
    },
    "url": {
      "type": "string",
      "pattern": "\\{\\}",
      "description": "URL of a profile page. \"{}\" is replaced by the username. Shown to the user."
    },
    "urlMain": {
      "type": "string",
      "format": "uri",
      "description": "Home page of the site."
    },
    "urlProbe": {
      "description": "URL actually requested, when it differs from `url` (an API endpoint for example).",
      "type": "string",
      "pattern": "\\{\\}"
    },
    "errorType": {
      "anyOf": [
        {
          "type": "string",
          "enum": [
            "message",
            "status_code",
            "response_url"
          ],
          "description": "How a missing account is detected: `message` (an error text is in the page), `status_code` (the HTTP status is not 2xx or is in `errorCode`) or `response_url` (the site redirects instead of answering 2xx)."
        },
        {
          "minItems": 1,
          "type": "array",
          "items": {
            "type": "string",
            "enum": [
              "message",
              "status_code",
              "response_url"
            ],
            "description": "How a missing account is detected: `message` (an error text is in the page), `status_code` (the HTTP status is not 2xx or is in `errorCode`) or `response_url` (the site redirects instead of answering 2xx)."
          }
        }
      ],
      "description": "Detection strategy, or several strategies applied in order."
    },
    "errorMsg": {
      "description": "Text(s) present in the page when the account does NOT exist. Required by `message`.",
      "anyOf": [
        {
          "type": "string",
          "minLength": 1
        },
        {
          "minItems": 1,
          "type": "array",
          "items": {
            "type": "string",
            "minLength": 1
          }
        }
      ]
    },
    "errorCode": {
      "description": "HTTP status code(s) meaning the account does NOT exist, even if 2xx.",
      "anyOf": [
        {
          "type": "integer",
          "minimum": 100,
          "maximum": 599
        },
        {
          "minItems": 1,
          "type": "array",
          "items": {
            "type": "integer",
            "minimum": 100,
            "maximum": 599
          }
        }
      ]
    },
    "regexCheck": {
      "description": "Usernames that do not match this regex are not supported by the site (no request).",
      "type": "string"
    },
    "username_claimed": {
      "type": "string",
      "minLength": 1,
      "description": "A username known to exist on the site. Used by the automated checks."
    },
    "tags": {
      "default": [],
      "description": "Categories used for filtering, e.g. [\"dev\"], [\"social\"], [\"music\"].",
      "type": "array",
      "items": {
        "type": "string",
        "pattern": "^[a-z0-9]+(-[a-z0-9]+)*$"
      }
    },
    "isNSFW": {
      "default": false,
      "description": "Adult content. Excluded from searches by default.",
      "type": "boolean"
    },
    "headers": {
      "description": "Extra HTTP headers sent with the request.",
      "type": "object",
      "propertyNames": {
        "type": "string"
      },
      "additionalProperties": {
        "type": "string"
      }
    },
    "request_method": {
      "description": "HTTP method. Defaults to HEAD for `status_code` only, GET otherwise.",
      "type": "string",
      "enum": [
        "GET",
        "HEAD",
        "POST",
        "PUT"
      ]
    },
    "request_payload": {
      "description": "JSON body sent with the request. \"{}\" is replaced by the username, recursively."
    }
  },
  "required": [
    "name",
    "url",
    "urlMain",
    "errorType",
    "username_claimed"
  ],
  "additionalProperties": false,
  "$id": "https://github.com/Rushclin/empreinte/blob/main/schema/site.schema.json",
  "title": "Empreinte site definition",
  "description": "One website supported by Empreinte. Generated from packages/core/src/schema.ts by `pnpm gen-schema`; do not edit by hand.",
  "if": {
    "properties": {
      "errorType": {
        "anyOf": [
          {
            "const": "message"
          },
          {
            "type": "array",
            "contains": {
              "const": "message"
            }
          }
        ]
      }
    },
    "required": [
      "errorType"
    ]
  },
  "then": {
    "required": [
      "errorMsg"
    ]
  }
}
