{
  "$schema": "../schema/site.schema.json",
  "name": "Medium",
  "url": "https://medium.com/@{}",
  "urlMain": "https://medium.com/",
  "urlProbe": "https://medium.com/feed/@{}",
  "errorType": "message",
  "errorMsg": "<body",
  "username_claimed": "blue",
  "tags": ["blogging"],
  "isNSFW": false
}
