{
  "$schema": "../schema/site.schema.json",
  "name": "Venmo",
  "url": "https://account.venmo.com/u/{}",
  "urlMain": "https://venmo.com/",
  "urlProbe": "https://test1.venmo.com/u/{}",
  "errorType": "message",
  "errorMsg": ["Venmo | Page Not Found"],
  "username_claimed": "jenny",
  "headers": {
    "Host": "account.venmo.com"
  },
  "tags": [],
  "isNSFW": false
}
