{
  "$schema": "../schema/site.schema.json",
  "name": "Telegram",
  "url": "https://t.me/{}",
  "urlMain": "https://t.me/",
  "errorType": "message",
  "errorMsg": [
    "<title>Telegram Messenger</title>",
    "If you have <strong>Telegram</strong>, you can contact <a class=\"tgme_username_link\" href=\"tg://resolve?domain="
  ],
  "regexCheck": "^[a-zA-Z0-9_]{3,32}[^_]$",
  "username_claimed": "blue",
  "tags": ["messaging"],
  "isNSFW": false
}
