{
  "$schema": "../schema/site.schema.json",
  "name": "Terraria Forums",
  "url": "https://forums.terraria.org/index.php?search/42798315/&c[users]={}&o=relevance",
  "urlMain": "https://forums.terraria.org/index.php",
  "errorType": "message",
  "errorMsg": "The following members could not be found",
  "username_claimed": "blue",
  "tags": [],
  "isNSFW": false
}
