{
  "$schema": "../schema/site.schema.json",
  "name": "Trello",
  "url": "https://trello.com/{}",
  "urlMain": "https://trello.com/",
  "urlProbe": "https://trello.com/1/Members/{}",
  "errorType": "message",
  "errorMsg": "model not found",
  "username_claimed": "blue",
  "tags": [],
  "isNSFW": false
}
