{
  "$schema": "../schema/site.schema.json",
  "name": "Threads",
  "url": "https://www.threads.net/@{}",
  "urlMain": "https://www.threads.net/",
  "errorType": "message",
  "errorMsg": "<title>Threads • Log in</title>",
  "username_claimed": "zuck",
  "headers": {
    "Sec-Fetch-Mode": "navigate"
  },
  "tags": ["social"],
  "isNSFW": false
}
