{
  "$schema": "../schema/site.schema.json",
  "name": "Reddit",
  "url": "https://www.reddit.com/user/{}",
  "urlMain": "https://www.reddit.com/",
  "errorType": "message",
  "errorMsg": "Sorry, nobody on Reddit goes by that name.",
  "username_claimed": "blue",
  "headers": {
    "accept-language": "en-US,en;q=0.9"
  },
  "tags": [
    "social",
    "forum"
  ],
  "isNSFW": false
}
