{
  "$schema": "../schema/site.schema.json",
  "name": "Dribbble",
  "url": "https://dribbble.com/{}",
  "urlMain": "https://dribbble.com/",
  "errorType": "message",
  "errorMsg": "Whoops, that page is gone.",
  "regexCheck": "^[a-zA-Z][a-zA-Z0-9_-]*$",
  "username_claimed": "blue",
  "tags": ["art", "design"],
  "isNSFW": false
}
