{
  "$schema": "../schema/site.schema.json",
  "name": "Archive.org",
  "url": "https://archive.org/details/@{}",
  "urlMain": "https://archive.org",
  "urlProbe": "https://archive.org/details/@{}?noscript=true",
  "errorType": "message",
  "errorMsg": [
    "could not fetch an account with user item identifier",
    "The resource could not be found",
    "Internet Archive services are temporarily offline"
  ],
  "username_claimed": "blue",
  "tags": [],
  "isNSFW": false
}
